{
  "client_id": 1094,
  "scenario": "happy_path",
  "generator": "template",
  "events": [
    {
      "seq": 0,
      "t_offset_ms": 1926,
      "agent": "orchestrator",
      "type": "status",
      "title": "Referral received",
      "detail": "New referral from UCSF Medical Center for client 1094. Starting intake pipeline."
    },
    {
      "seq": 1,
      "t_offset_ms": 3227,
      "agent": "intake",
      "type": "output",
      "title": "Client profile structured",
      "detail": "Diet orders: diabetic. Allergies: peanut, fish. Sodium ceiling 800 mg/meal, carbs 45–60 g/meal. Prefers American; dislikes pork. Cooking ability: full. 7 meals/week, zone Excelsior."
    },
    {
      "seq": 2,
      "t_offset_ms": 4402,
      "agent": "orchestrator",
      "type": "status",
      "title": "Dispatching Clinical Matching Agent",
      "detail": "Hard constraint hierarchy locked: allergens → sodium → carbs → diet-order tags. Exclusion rules, never scoring penalties."
    },
    {
      "seq": 3,
      "t_offset_ms": 5596,
      "agent": "matching",
      "type": "thought",
      "title": "Scanning inventory",
      "detail": "Scoring all 80 meals against hard constraints, then ranking survivors by cuisine preference and dislike avoidance."
    },
    {
      "seq": 4,
      "t_offset_ms": 7608,
      "agent": "matching",
      "type": "check",
      "title": "Rejected: Grilled Chicken Garden Salad",
      "detail": "Excluded — carbs: 39 g outside 45–60 g range.",
      "data": {
        "meal_id": "M044",
        "result": "fail"
      }
    },
    {
      "seq": 5,
      "t_offset_ms": 9513,
      "agent": "matching",
      "type": "check",
      "title": "Rejected: Baked Salmon with Quinoa",
      "detail": "Excluded — allergen: contains fish.",
      "data": {
        "meal_id": "M043",
        "result": "fail"
      }
    },
    {
      "seq": 6,
      "t_offset_ms": 11788,
      "agent": "matching",
      "type": "check",
      "title": "Matched: Overnight Oats with Berries",
      "detail": "All hard checks pass — sodium 300/800 mg ✓, carbs 55 g (target 45–60) ✓, no peanut/fish ✓. Sourced from kitchen batch B7.",
      "data": {
        "meal_id": "M050",
        "result": "pass"
      }
    },
    {
      "seq": 7,
      "t_offset_ms": 12719,
      "agent": "matching",
      "type": "check",
      "title": "Matched: Winter Melon Soup with Chicken and Rice",
      "detail": "All hard checks pass — sodium 354/800 mg ✓, carbs 45 g (target 45–60) ✓, no peanut/fish ✓. Sourced from kitchen batch B6.",
      "data": {
        "meal_id": "M020",
        "result": "pass"
      }
    },
    {
      "seq": 8,
      "t_offset_ms": 15093,
      "agent": "matching",
      "type": "check",
      "title": "Matched: Ginataang Gulay with Rice",
      "detail": "All hard checks pass — sodium 401/800 mg ✓, carbs 51 g (target 45–60) ✓, no peanut/fish ✓.",
      "data": {
        "meal_id": "M006",
        "result": "pass"
      }
    },
    {
      "seq": 9,
      "t_offset_ms": 17291,
      "agent": "kitchen",
      "type": "output",
      "title": "Batch allocated: Overnight Oats with Berries",
      "detail": "Serving drawn from scheduled batch B7 (110 servings, 10 labor hours on 2026-07-20).",
      "data": {
        "batch_id": "B7"
      }
    },
    {
      "seq": 10,
      "t_offset_ms": 19357,
      "agent": "kitchen",
      "type": "output",
      "title": "Batch allocated: Winter Melon Soup with Chicken and Rice",
      "detail": "Serving drawn from scheduled batch B6 (80 servings, 7 labor hours on 2026-07-22).",
      "data": {
        "batch_id": "B6"
      }
    },
    {
      "seq": 11,
      "t_offset_ms": 20739,
      "agent": "kitchen",
      "type": "output",
      "title": "Batch allocated: Chicken Congee with Scallions",
      "detail": "Serving drawn from scheduled batch B2 (120 servings, 10 labor hours on 2026-07-20).",
      "data": {
        "batch_id": "B2"
      }
    },
    {
      "seq": 12,
      "t_offset_ms": 22237,
      "agent": "donation",
      "type": "check",
      "title": "Donation D002 feeds batch B2",
      "detail": "Fresh Bok Choy (cases), Carrots (25 lb bags) from Bay Area Produce Exchange — triaged as kitchen ingredient.",
      "data": {
        "donation_id": "D002",
        "result": "kitchen_ingredient"
      }
    },
    {
      "seq": 13,
      "t_offset_ms": 23688,
      "agent": "delivery",
      "type": "output",
      "title": "Pickup scheduled",
      "detail": "Meals for client 1094 ready for pickup 2026-07-21, window 10:00–12:00 (Excelsior group). Cold chain OK.",
      "data": {
        "route_id": "R-EXCE-2"
      }
    },
    {
      "seq": 14,
      "t_offset_ms": 24930,
      "agent": "orchestrator",
      "type": "output",
      "title": "Plan complete",
      "detail": "Client 1094: 7 compliant meal(s) at fallback level 1. 0 hard-constraint violations."
    }
  ]
}
