{
  "client_id": 1083,
  "scenario": "happy_path",
  "generator": "template",
  "events": [
    {
      "seq": 0,
      "t_offset_ms": 1387,
      "agent": "orchestrator",
      "type": "status",
      "title": "Referral received",
      "detail": "New referral from Kaiser Permanente San Francisco for client 1083. Starting intake pipeline."
    },
    {
      "seq": 1,
      "t_offset_ms": 3908,
      "agent": "intake",
      "type": "output",
      "title": "Client profile structured",
      "detail": "Diet orders: cardiovascular. Allergies: sesame. Sodium ceiling 650 mg/meal, carbs 35–70 g/meal. Prefers Mexican; dislikes nothing noted. Cooking ability: microwave. 10 meals/week, zone Mission."
    },
    {
      "seq": 2,
      "t_offset_ms": 6459,
      "agent": "orchestrator",
      "type": "status",
      "title": "Dispatching Clinical Matching Agent",
      "detail": "Hard constraint hierarchy locked: allergens → sodium → carbs → diet-order tags. Exclusion rules, never scoring penalties."
    },
    {
      "seq": 3,
      "t_offset_ms": 7965,
      "agent": "matching",
      "type": "thought",
      "title": "Scanning inventory",
      "detail": "Scoring all 80 meals against hard constraints, then ranking survivors by cuisine preference and dislike avoidance."
    },
    {
      "seq": 4,
      "t_offset_ms": 8944,
      "agent": "matching",
      "type": "check",
      "title": "Rejected: Veggie Enchiladas",
      "detail": "Excluded — diet order 'cardiovascular': meal lacks 'heart-healthy' tag.",
      "data": {
        "meal_id": "M033",
        "result": "fail"
      }
    },
    {
      "seq": 5,
      "t_offset_ms": 10063,
      "agent": "matching",
      "type": "check",
      "title": "Rejected: Chicken Pozole Verde",
      "detail": "Excluded — diet order 'cardiovascular': meal lacks 'heart-healthy' tag.",
      "data": {
        "meal_id": "M036",
        "result": "fail"
      }
    },
    {
      "seq": 6,
      "t_offset_ms": 12507,
      "agent": "matching",
      "type": "check",
      "title": "Matched: Overnight Oats with Berries",
      "detail": "All hard checks pass — sodium 300/650 mg ✓, carbs 55 g (target 35–70) ✓, no sesame ✓.",
      "data": {
        "meal_id": "M050",
        "result": "pass"
      }
    },
    {
      "seq": 7,
      "t_offset_ms": 13420,
      "agent": "matching",
      "type": "check",
      "title": "Matched: Winter Melon Soup with Chicken and Rice",
      "detail": "All hard checks pass — sodium 354/650 mg ✓, carbs 45 g (target 35–70) ✓, no sesame ✓. Sourced from kitchen batch B6.",
      "data": {
        "meal_id": "M020",
        "result": "pass"
      }
    },
    {
      "seq": 8,
      "t_offset_ms": 14811,
      "agent": "matching",
      "type": "check",
      "title": "Matched: Ginataang Gulay with Rice",
      "detail": "All hard checks pass — sodium 401/650 mg ✓, carbs 51 g (target 35–70) ✓, no sesame ✓.",
      "data": {
        "meal_id": "M006",
        "result": "pass"
      }
    },
    {
      "seq": 9,
      "t_offset_ms": 16611,
      "agent": "kitchen",
      "type": "output",
      "title": "Batch allocated: Winter Melon Soup with Chicken and Rice",
      "detail": "Serving drawn from scheduled batch B6 (80 servings, 7 labor hours on 2026-07-22).",
      "data": {
        "batch_id": "B6"
      }
    },
    {
      "seq": 10,
      "t_offset_ms": 18905,
      "agent": "kitchen",
      "type": "output",
      "title": "Batch allocated: Chicken Congee with Scallions",
      "detail": "Serving drawn from scheduled batch B2 (120 servings, 10 labor hours on 2026-07-20).",
      "data": {
        "batch_id": "B2"
      }
    },
    {
      "seq": 11,
      "t_offset_ms": 19917,
      "agent": "donation",
      "type": "check",
      "title": "Donation D002 feeds batch B2",
      "detail": "Fresh Bok Choy (cases), Carrots (25 lb bags) from Bay Area Produce Exchange — triaged as kitchen ingredient.",
      "data": {
        "donation_id": "D002",
        "result": "kitchen_ingredient"
      }
    },
    {
      "seq": 12,
      "t_offset_ms": 21983,
      "agent": "delivery",
      "type": "output",
      "title": "Pickup scheduled",
      "detail": "Meals for client 1083 ready for pickup 2026-07-21, window 14:00–16:00 (Mission group). Cold chain OK.",
      "data": {
        "route_id": "R-MISS-1"
      }
    },
    {
      "seq": 13,
      "t_offset_ms": 23428,
      "agent": "orchestrator",
      "type": "output",
      "title": "Plan complete",
      "detail": "Client 1083: 7 compliant meal(s) at fallback level 1. 0 hard-constraint violations."
    }
  ]
}
