{
  "client_id": 1139,
  "scenario": "happy_path",
  "generator": "template",
  "events": [
    {
      "seq": 0,
      "t_offset_ms": 1465,
      "agent": "orchestrator",
      "type": "status",
      "title": "Referral received",
      "detail": "New referral from Saint Francis Memorial for client 1139. Starting intake pipeline."
    },
    {
      "seq": 1,
      "t_offset_ms": 3490,
      "agent": "intake",
      "type": "output",
      "title": "Client profile structured",
      "detail": "Diet orders: diabetic. Allergies: tree_nut. Sodium ceiling 800 mg/meal, carbs 45–65 g/meal. Prefers Mediterranean; dislikes mushrooms. Cooking ability: stovetop. 7 meals/week, zone Western Addition."
    },
    {
      "seq": 2,
      "t_offset_ms": 5498,
      "agent": "orchestrator",
      "type": "status",
      "title": "Dispatching Clinical Matching Agent",
      "detail": "Hard constraint hierarchy locked: allergens → sodium → carbs → diet-order tags. Exclusion rules, never scoring penalties."
    },
    {
      "seq": 3,
      "t_offset_ms": 7414,
      "agent": "matching",
      "type": "thought",
      "title": "Scanning inventory",
      "detail": "Scoring all 80 meals against hard constraints, then ranking survivors by cuisine preference and dislike avoidance."
    },
    {
      "seq": 4,
      "t_offset_ms": 8890,
      "agent": "matching",
      "type": "check",
      "title": "Rejected: Baked Cod with Herbed Couscous",
      "detail": "Excluded — carbs: 41 g outside 45–65 g range.",
      "data": {
        "meal_id": "M055",
        "result": "fail"
      }
    },
    {
      "seq": 5,
      "t_offset_ms": 10795,
      "agent": "matching",
      "type": "check",
      "title": "Rejected: Tabbouleh with Grilled Chicken",
      "detail": "Excluded — carbs: 40 g outside 45–65 g range.",
      "data": {
        "meal_id": "M057",
        "result": "fail"
      }
    },
    {
      "seq": 6,
      "t_offset_ms": 13194,
      "agent": "matching",
      "type": "check",
      "title": "Matched: Overnight Oats with Berries",
      "detail": "All hard checks pass — sodium 300/800 mg ✓, carbs 55 g (target 45–65) ✓, no tree_nut ✓. Sourced from kitchen batch B7.",
      "data": {
        "meal_id": "M050",
        "result": "pass"
      }
    },
    {
      "seq": 7,
      "t_offset_ms": 14401,
      "agent": "matching",
      "type": "check",
      "title": "Matched: Winter Melon Soup with Chicken and Rice",
      "detail": "All hard checks pass — sodium 354/800 mg ✓, carbs 45 g (target 45–65) ✓, no tree_nut ✓. Sourced from kitchen batch B6.",
      "data": {
        "meal_id": "M020",
        "result": "pass"
      }
    },
    {
      "seq": 8,
      "t_offset_ms": 15951,
      "agent": "matching",
      "type": "check",
      "title": "Matched: Hummus and Veggie Wrap",
      "detail": "All hard checks pass — sodium 451/800 mg ✓, carbs 52 g (target 45–65) ✓, no tree_nut ✓.",
      "data": {
        "meal_id": "M060",
        "result": "pass"
      }
    },
    {
      "seq": 9,
      "t_offset_ms": 17063,
      "agent": "kitchen",
      "type": "output",
      "title": "Batch allocated: Overnight Oats with Berries",
      "detail": "Serving drawn from scheduled batch B7 (110 servings, 10 labor hours on 2026-07-20).",
      "data": {
        "batch_id": "B7"
      }
    },
    {
      "seq": 10,
      "t_offset_ms": 18985,
      "agent": "kitchen",
      "type": "output",
      "title": "Batch allocated: Winter Melon Soup with Chicken and Rice",
      "detail": "Serving drawn from scheduled batch B6 (80 servings, 7 labor hours on 2026-07-22).",
      "data": {
        "batch_id": "B6"
      }
    },
    {
      "seq": 11,
      "t_offset_ms": 20229,
      "agent": "kitchen",
      "type": "output",
      "title": "Batch allocated: Chicken Congee with Scallions",
      "detail": "Serving drawn from scheduled batch B2 (120 servings, 10 labor hours on 2026-07-20).",
      "data": {
        "batch_id": "B2"
      }
    },
    {
      "seq": 12,
      "t_offset_ms": 22180,
      "agent": "donation",
      "type": "check",
      "title": "Donation D002 feeds batch B2",
      "detail": "Fresh Bok Choy (cases), Carrots (25 lb bags) from Bay Area Produce Exchange — triaged as kitchen ingredient.",
      "data": {
        "donation_id": "D002",
        "result": "kitchen_ingredient"
      }
    },
    {
      "seq": 13,
      "t_offset_ms": 24192,
      "agent": "kitchen",
      "type": "output",
      "title": "Batch allocated: Steamed Fish with Ginger and Rice",
      "detail": "Serving drawn from scheduled batch B5 (20 servings, 2 labor hours on 2026-07-21).",
      "data": {
        "batch_id": "B5"
      }
    },
    {
      "seq": 14,
      "t_offset_ms": 25144,
      "agent": "delivery",
      "type": "output",
      "title": "Pickup scheduled",
      "detail": "Meals for client 1139 ready for pickup 2026-07-21, window 10:00–12:00 (Western Addition group). Cold chain OK.",
      "data": {
        "route_id": "R-WEST-2"
      }
    },
    {
      "seq": 15,
      "t_offset_ms": 27078,
      "agent": "orchestrator",
      "type": "output",
      "title": "Plan complete",
      "detail": "Client 1139: 7 compliant meal(s) at fallback level 1. 0 hard-constraint violations."
    }
  ]
}
