{
  "client_id": 1113,
  "scenario": "happy_path",
  "generator": "template",
  "events": [
    {
      "seq": 0,
      "t_offset_ms": 1382,
      "agent": "orchestrator",
      "type": "status",
      "title": "Referral received",
      "detail": "New referral from Saint Francis Memorial for client 1113. Starting intake pipeline."
    },
    {
      "seq": 1,
      "t_offset_ms": 2764,
      "agent": "intake",
      "type": "output",
      "title": "Client profile structured",
      "detail": "Diet orders: diabetic. Allergies: none. Sodium ceiling 800 mg/meal, carbs 45–60 g/meal. Prefers Mexican; dislikes nothing noted. Cooking ability: microwave. 7 meals/week, zone Bayview-Hunters Point."
    },
    {
      "seq": 2,
      "t_offset_ms": 4651,
      "agent": "orchestrator",
      "type": "status",
      "title": "Dispatching Clinical Matching Agent",
      "detail": "Hard constraint hierarchy locked: allergens → sodium → carbs → diet-order tags. Exclusion rules, never scoring penalties."
    },
    {
      "seq": 3,
      "t_offset_ms": 5722,
      "agent": "matching",
      "type": "thought",
      "title": "Scanning inventory",
      "detail": "Scoring all 80 meals against hard constraints, then ranking survivors by cuisine preference and dislike avoidance."
    },
    {
      "seq": 4,
      "t_offset_ms": 7416,
      "agent": "matching",
      "type": "check",
      "title": "Rejected: Calabacitas con Pollo",
      "detail": "Excluded — carbs: 43 g outside 45–60 g range.",
      "data": {
        "meal_id": "M038",
        "result": "fail"
      }
    },
    {
      "seq": 5,
      "t_offset_ms": 8944,
      "agent": "matching",
      "type": "check",
      "title": "Rejected: Chicken Pozole Verde",
      "detail": "Excluded — carbs: 43 g outside 45–60 g range.",
      "data": {
        "meal_id": "M036",
        "result": "fail"
      }
    },
    {
      "seq": 6,
      "t_offset_ms": 11058,
      "agent": "matching",
      "type": "check",
      "title": "Matched: Overnight Oats with Berries",
      "detail": "All hard checks pass — sodium 300/800 mg ✓, carbs 55 g (target 45–60) ✓. Sourced from kitchen batch B7.",
      "data": {
        "meal_id": "M050",
        "result": "pass"
      }
    },
    {
      "seq": 7,
      "t_offset_ms": 13463,
      "agent": "matching",
      "type": "check",
      "title": "Matched: Winter Melon Soup with Chicken and Rice",
      "detail": "All hard checks pass — sodium 354/800 mg ✓, carbs 45 g (target 45–60) ✓. Sourced from kitchen batch B6.",
      "data": {
        "meal_id": "M020",
        "result": "pass"
      }
    },
    {
      "seq": 8,
      "t_offset_ms": 14684,
      "agent": "matching",
      "type": "check",
      "title": "Matched: Ginataang Gulay with Rice",
      "detail": "All hard checks pass — sodium 401/800 mg ✓, carbs 51 g (target 45–60) ✓.",
      "data": {
        "meal_id": "M006",
        "result": "pass"
      }
    },
    {
      "seq": 9,
      "t_offset_ms": 15870,
      "agent": "kitchen",
      "type": "output",
      "title": "Batch allocated: Overnight Oats with Berries",
      "detail": "Serving drawn from scheduled batch B7 (110 servings, 10 labor hours on 2026-07-20).",
      "data": {
        "batch_id": "B7"
      }
    },
    {
      "seq": 10,
      "t_offset_ms": 16853,
      "agent": "kitchen",
      "type": "output",
      "title": "Batch allocated: Winter Melon Soup with Chicken and Rice",
      "detail": "Serving drawn from scheduled batch B6 (80 servings, 7 labor hours on 2026-07-22).",
      "data": {
        "batch_id": "B6"
      }
    },
    {
      "seq": 11,
      "t_offset_ms": 18172,
      "agent": "kitchen",
      "type": "output",
      "title": "Batch allocated: Chicken Congee with Scallions",
      "detail": "Serving drawn from scheduled batch B2 (120 servings, 10 labor hours on 2026-07-20).",
      "data": {
        "batch_id": "B2"
      }
    },
    {
      "seq": 12,
      "t_offset_ms": 20471,
      "agent": "donation",
      "type": "check",
      "title": "Donation D002 feeds batch B2",
      "detail": "Fresh Bok Choy (cases), Carrots (25 lb bags) from Bay Area Produce Exchange — triaged as kitchen ingredient.",
      "data": {
        "donation_id": "D002",
        "result": "kitchen_ingredient"
      }
    },
    {
      "seq": 13,
      "t_offset_ms": 22313,
      "agent": "delivery",
      "type": "output",
      "title": "Pickup scheduled",
      "detail": "Meals for client 1113 ready for pickup 2026-07-21, window 14:00–16:00 (Bayview-Hunters Point group). Cold chain OK.",
      "data": {
        "route_id": "R-BAYV-2"
      }
    },
    {
      "seq": 14,
      "t_offset_ms": 24545,
      "agent": "orchestrator",
      "type": "output",
      "title": "Plan complete",
      "detail": "Client 1113: 7 compliant meal(s) at fallback level 1. 0 hard-constraint violations."
    }
  ]
}
