{
  "client_id": 1002,
  "scenario": "happy_path",
  "generator": "template",
  "events": [
    {
      "seq": 0,
      "t_offset_ms": 1997,
      "agent": "orchestrator",
      "type": "status",
      "title": "Referral received",
      "detail": "New referral from Saint Francis Memorial for client 1002. Starting intake pipeline."
    },
    {
      "seq": 1,
      "t_offset_ms": 3037,
      "agent": "intake",
      "type": "output",
      "title": "Client profile structured",
      "detail": "Diet orders: cardiovascular. Allergies: none. Sodium ceiling 600 mg/meal, carbs 45–75 g/meal. Prefers Vietnamese; dislikes nothing noted. Cooking ability: microwave. 7 meals/week, zone Excelsior."
    },
    {
      "seq": 2,
      "t_offset_ms": 4008,
      "agent": "orchestrator",
      "type": "status",
      "title": "Dispatching Clinical Matching Agent",
      "detail": "Hard constraint hierarchy locked: allergens → sodium → carbs → diet-order tags. Exclusion rules, never scoring penalties."
    },
    {
      "seq": 3,
      "t_offset_ms": 4950,
      "agent": "matching",
      "type": "thought",
      "title": "Scanning inventory",
      "detail": "Scoring all 80 meals against hard constraints, then ranking survivors by cuisine preference and dislike avoidance."
    },
    {
      "seq": 4,
      "t_offset_ms": 7386,
      "agent": "matching",
      "type": "check",
      "title": "Rejected: Fresh Spring Rolls with Chicken",
      "detail": "Excluded — carbs: 41 g outside 45–75 g range.",
      "data": {
        "meal_id": "M026",
        "result": "fail"
      }
    },
    {
      "seq": 5,
      "t_offset_ms": 8906,
      "agent": "matching",
      "type": "check",
      "title": "Rejected: Beef Pho with Rice Noodles",
      "detail": "Excluded — diet order 'cardiovascular': meal lacks 'heart-healthy' tag.",
      "data": {
        "meal_id": "M029",
        "result": "fail"
      }
    },
    {
      "seq": 6,
      "t_offset_ms": 10648,
      "agent": "matching",
      "type": "check",
      "title": "Matched: Overnight Oats with Berries",
      "detail": "All hard checks pass — sodium 300/600 mg ✓, carbs 55 g (target 45–75) ✓.",
      "data": {
        "meal_id": "M050",
        "result": "pass"
      }
    },
    {
      "seq": 7,
      "t_offset_ms": 11967,
      "agent": "matching",
      "type": "check",
      "title": "Matched: Winter Melon Soup with Chicken and Rice",
      "detail": "All hard checks pass — sodium 354/600 mg ✓, carbs 45 g (target 45–75) ✓.",
      "data": {
        "meal_id": "M020",
        "result": "pass"
      }
    },
    {
      "seq": 8,
      "t_offset_ms": 14415,
      "agent": "matching",
      "type": "check",
      "title": "Matched: Ginataang Gulay with Rice",
      "detail": "All hard checks pass — sodium 401/600 mg ✓, carbs 51 g (target 45–75) ✓.",
      "data": {
        "meal_id": "M006",
        "result": "pass"
      }
    },
    {
      "seq": 9,
      "t_offset_ms": 16769,
      "agent": "delivery",
      "type": "output",
      "title": "Route assigned",
      "detail": "Client 1002 added to route R-EXCE-1 (Excelsior), delivery 2026-07-21, window 14:00–16:00. Cold chain OK.",
      "data": {
        "route_id": "R-EXCE-1"
      }
    },
    {
      "seq": 10,
      "t_offset_ms": 17941,
      "agent": "orchestrator",
      "type": "output",
      "title": "Plan complete",
      "detail": "Client 1002: 7 compliant meal(s) at fallback level 0. 0 hard-constraint violations."
    }
  ]
}
