{
  "client_id": 1129,
  "scenario": "happy_path",
  "generator": "template",
  "events": [
    {
      "seq": 0,
      "t_offset_ms": 2382,
      "agent": "orchestrator",
      "type": "status",
      "title": "Referral received",
      "detail": "New referral from Kaiser Permanente San Francisco for client 1129. Starting intake pipeline."
    },
    {
      "seq": 1,
      "t_offset_ms": 4004,
      "agent": "intake",
      "type": "output",
      "title": "Client profile structured",
      "detail": "Diet orders: diabetic. Allergies: none. Sodium ceiling 800 mg/meal, carbs 45–65 g/meal. Prefers Mexican; dislikes mushrooms. Cooking ability: microwave. 5 meals/week, zone Excelsior."
    },
    {
      "seq": 2,
      "t_offset_ms": 6596,
      "agent": "orchestrator",
      "type": "status",
      "title": "Dispatching Clinical Matching Agent",
      "detail": "Hard constraint hierarchy locked: allergens → sodium → carbs → diet-order tags. Exclusion rules, never scoring penalties."
    },
    {
      "seq": 3,
      "t_offset_ms": 8068,
      "agent": "matching",
      "type": "thought",
      "title": "Scanning inventory",
      "detail": "Scoring all 80 meals against hard constraints, then ranking survivors by cuisine preference and dislike avoidance."
    },
    {
      "seq": 4,
      "t_offset_ms": 9187,
      "agent": "matching",
      "type": "check",
      "title": "Rejected: Calabacitas con Pollo",
      "detail": "Excluded — carbs: 43 g outside 45–65 g range.",
      "data": {
        "meal_id": "M038",
        "result": "fail"
      }
    },
    {
      "seq": 5,
      "t_offset_ms": 11062,
      "agent": "matching",
      "type": "check",
      "title": "Rejected: Chicken Pozole Verde",
      "detail": "Excluded — carbs: 43 g outside 45–65 g range.",
      "data": {
        "meal_id": "M036",
        "result": "fail"
      }
    },
    {
      "seq": 6,
      "t_offset_ms": 12017,
      "agent": "matching",
      "type": "check",
      "title": "Matched: Turkey Picadillo with Rice",
      "detail": "All hard checks pass — sodium 440/800 mg ✓, carbs 48 g (target 45–65) ✓.",
      "data": {
        "meal_id": "M039",
        "result": "pass"
      }
    },
    {
      "seq": 7,
      "t_offset_ms": 14519,
      "agent": "matching",
      "type": "check",
      "title": "Matched: Chicken Fajita Bowl",
      "detail": "All hard checks pass — sodium 450/800 mg ✓, carbs 57 g (target 45–65) ✓.",
      "data": {
        "meal_id": "M031",
        "result": "pass"
      }
    },
    {
      "seq": 8,
      "t_offset_ms": 15878,
      "agent": "matching",
      "type": "check",
      "title": "Matched: Chicken Tinga with Rice",
      "detail": "All hard checks pass — sodium 454/800 mg ✓, carbs 48 g (target 45–65) ✓.",
      "data": {
        "meal_id": "M037",
        "result": "pass"
      }
    },
    {
      "seq": 9,
      "t_offset_ms": 16887,
      "agent": "delivery",
      "type": "output",
      "title": "Route assigned",
      "detail": "Client 1129 added to route R-EXCE-2 (Excelsior), delivery 2026-07-21, window 10:00–12:00. Cold chain OK.",
      "data": {
        "route_id": "R-EXCE-2"
      }
    },
    {
      "seq": 10,
      "t_offset_ms": 18105,
      "agent": "orchestrator",
      "type": "output",
      "title": "Plan complete",
      "detail": "Client 1129: 5 compliant meal(s) at fallback level 0. 0 hard-constraint violations."
    }
  ]
}
