{
  "client_id": 1043,
  "scenario": "happy_path",
  "generator": "template",
  "events": [
    {
      "seq": 0,
      "t_offset_ms": 1079,
      "agent": "orchestrator",
      "type": "status",
      "title": "Referral received",
      "detail": "New referral from Saint Francis Memorial for client 1043. Starting intake pipeline."
    },
    {
      "seq": 1,
      "t_offset_ms": 2662,
      "agent": "intake",
      "type": "output",
      "title": "Client profile structured",
      "detail": "Diet orders: cardiovascular. Allergies: gluten. Sodium ceiling 700 mg/meal, carbs 40–70 g/meal. Prefers Italian; dislikes tofu. Cooking ability: microwave. 5 meals/week, zone Sunset."
    },
    {
      "seq": 2,
      "t_offset_ms": 5040,
      "agent": "orchestrator",
      "type": "status",
      "title": "Dispatching Clinical Matching Agent",
      "detail": "Hard constraint hierarchy locked: allergens → sodium → carbs → diet-order tags. Exclusion rules, never scoring penalties."
    },
    {
      "seq": 3,
      "t_offset_ms": 6419,
      "agent": "matching",
      "type": "thought",
      "title": "Scanning inventory",
      "detail": "Scoring all 80 meals against hard constraints, then ranking survivors by cuisine preference and dislike avoidance."
    },
    {
      "seq": 4,
      "t_offset_ms": 7494,
      "agent": "matching",
      "type": "check",
      "title": "Rejected: Minestrone with Whole-Grain Roll",
      "detail": "Excluded — allergen: contains gluten.",
      "data": {
        "meal_id": "M073",
        "result": "fail"
      }
    },
    {
      "seq": 5,
      "t_offset_ms": 9161,
      "agent": "matching",
      "type": "check",
      "title": "Rejected: Chicken Pasta Primavera",
      "detail": "Excluded — allergen: contains gluten.",
      "data": {
        "meal_id": "M071",
        "result": "fail"
      }
    },
    {
      "seq": 6,
      "t_offset_ms": 10187,
      "agent": "matching",
      "type": "check",
      "title": "Matched: Tuscan White Bean Soup",
      "detail": "All hard checks pass — sodium 413/700 mg ✓, carbs 53 g (target 40–70) ✓, no gluten ✓.",
      "data": {
        "meal_id": "M079",
        "result": "pass"
      }
    },
    {
      "seq": 7,
      "t_offset_ms": 12248,
      "agent": "matching",
      "type": "check",
      "title": "Matched: Grilled Chicken with Creamy Polenta",
      "detail": "All hard checks pass — sodium 445/700 mg ✓, carbs 52 g (target 40–70) ✓, no gluten ✓.",
      "data": {
        "meal_id": "M080",
        "result": "pass"
      }
    },
    {
      "seq": 8,
      "t_offset_ms": 14259,
      "agent": "matching",
      "type": "check",
      "title": "Matched: Chicken Piccata with Rice",
      "detail": "All hard checks pass — sodium 474/700 mg ✓, carbs 47 g (target 40–70) ✓, no gluten ✓.",
      "data": {
        "meal_id": "M075",
        "result": "pass"
      }
    },
    {
      "seq": 9,
      "t_offset_ms": 16519,
      "agent": "delivery",
      "type": "output",
      "title": "Route assigned",
      "detail": "Client 1043 added to route R-SUNS-1 (Sunset), delivery 2026-07-21, window 10:00–12:00. Cold chain OK.",
      "data": {
        "route_id": "R-SUNS-1"
      }
    },
    {
      "seq": 10,
      "t_offset_ms": 18438,
      "agent": "orchestrator",
      "type": "output",
      "title": "Plan complete",
      "detail": "Client 1043: 5 compliant meal(s) at fallback level 0. 0 hard-constraint violations."
    }
  ]
}
