{
  "client_id": 1028,
  "scenario": "happy_path",
  "generator": "template",
  "events": [
    {
      "seq": 0,
      "t_offset_ms": 1616,
      "agent": "orchestrator",
      "type": "status",
      "title": "Referral received",
      "detail": "New referral from Saint Francis Memorial for client 1028. Starting intake pipeline."
    },
    {
      "seq": 1,
      "t_offset_ms": 3848,
      "agent": "intake",
      "type": "output",
      "title": "Client profile structured",
      "detail": "Diet orders: cardiovascular. Allergies: peanut. Sodium ceiling 600 mg/meal, carbs 45–75 g/meal. Prefers Mediterranean; dislikes pork, mushrooms. Cooking ability: stovetop. 7 meals/week, zone Excelsior."
    },
    {
      "seq": 2,
      "t_offset_ms": 6422,
      "agent": "orchestrator",
      "type": "status",
      "title": "Dispatching Clinical Matching Agent",
      "detail": "Hard constraint hierarchy locked: allergens → sodium → carbs → diet-order tags. Exclusion rules, never scoring penalties."
    },
    {
      "seq": 3,
      "t_offset_ms": 7766,
      "agent": "matching",
      "type": "thought",
      "title": "Scanning inventory",
      "detail": "Scoring all 80 meals against hard constraints, then ranking survivors by cuisine preference and dislike avoidance."
    },
    {
      "seq": 4,
      "t_offset_ms": 9680,
      "agent": "matching",
      "type": "check",
      "title": "Rejected: Baked Cod with Herbed Couscous",
      "detail": "Excluded — carbs: 41 g outside 45–75 g range.",
      "data": {
        "meal_id": "M055",
        "result": "fail"
      }
    },
    {
      "seq": 5,
      "t_offset_ms": 10720,
      "agent": "matching",
      "type": "check",
      "title": "Rejected: Tabbouleh with Grilled Chicken",
      "detail": "Excluded — carbs: 40 g outside 45–75 g range.",
      "data": {
        "meal_id": "M057",
        "result": "fail"
      }
    },
    {
      "seq": 6,
      "t_offset_ms": 12604,
      "agent": "matching",
      "type": "check",
      "title": "Matched: Overnight Oats with Berries",
      "detail": "All hard checks pass — sodium 300/600 mg ✓, carbs 55 g (target 45–75) ✓, no peanut ✓.",
      "data": {
        "meal_id": "M050",
        "result": "pass"
      }
    },
    {
      "seq": 7,
      "t_offset_ms": 15031,
      "agent": "matching",
      "type": "check",
      "title": "Matched: Winter Melon Soup with Chicken and Rice",
      "detail": "All hard checks pass — sodium 354/600 mg ✓, carbs 45 g (target 45–75) ✓, no peanut ✓.",
      "data": {
        "meal_id": "M020",
        "result": "pass"
      }
    },
    {
      "seq": 8,
      "t_offset_ms": 16997,
      "agent": "matching",
      "type": "check",
      "title": "Matched: Hummus and Veggie Wrap",
      "detail": "All hard checks pass — sodium 451/600 mg ✓, carbs 52 g (target 45–75) ✓, no peanut ✓.",
      "data": {
        "meal_id": "M060",
        "result": "pass"
      }
    },
    {
      "seq": 9,
      "t_offset_ms": 18417,
      "agent": "delivery",
      "type": "output",
      "title": "Route assigned",
      "detail": "Client 1028 added to route R-EXCE-1 (Excelsior), delivery 2026-07-21, window 14:00–16:00. Cold chain OK.",
      "data": {
        "route_id": "R-EXCE-1"
      }
    },
    {
      "seq": 10,
      "t_offset_ms": 20331,
      "agent": "orchestrator",
      "type": "output",
      "title": "Plan complete",
      "detail": "Client 1028: 7 compliant meal(s) at fallback level 0. 0 hard-constraint violations."
    }
  ]
}
