{
  "client_id": 1147,
  "scenario": "happy_path",
  "generator": "template",
  "events": [
    {
      "seq": 0,
      "t_offset_ms": 2241,
      "agent": "orchestrator",
      "type": "status",
      "title": "Referral received",
      "detail": "New referral from Saint Francis Memorial for client 1147. Starting intake pipeline."
    },
    {
      "seq": 1,
      "t_offset_ms": 3518,
      "agent": "intake",
      "type": "output",
      "title": "Client profile structured",
      "detail": "Diet orders: renal, cardiovascular. Allergies: none. Sodium ceiling 500 mg/meal, carbs 40–70 g/meal. Prefers Vietnamese; dislikes nothing noted. Cooking ability: microwave. 7 meals/week, zone Sunset."
    },
    {
      "seq": 2,
      "t_offset_ms": 5700,
      "agent": "orchestrator",
      "type": "status",
      "title": "Dispatching Clinical Matching Agent",
      "detail": "Hard constraint hierarchy locked: allergens → sodium → carbs → diet-order tags. Exclusion rules, never scoring penalties."
    },
    {
      "seq": 3,
      "t_offset_ms": 7211,
      "agent": "matching",
      "type": "thought",
      "title": "Scanning inventory",
      "detail": "Scoring all 80 meals against hard constraints, then ranking survivors by cuisine preference and dislike avoidance."
    },
    {
      "seq": 4,
      "t_offset_ms": 8512,
      "agent": "matching",
      "type": "check",
      "title": "Rejected: Tofu and Vegetable Curry with Rice",
      "detail": "Excluded — diet order 'renal': meal lacks 'renal-friendly' tag.",
      "data": {
        "meal_id": "M028",
        "result": "fail"
      }
    },
    {
      "seq": 5,
      "t_offset_ms": 9797,
      "agent": "matching",
      "type": "check",
      "title": "Rejected: Lemongrass Chicken with Rice",
      "detail": "Excluded — diet order 'renal': meal lacks 'renal-friendly' tag.",
      "data": {
        "meal_id": "M022",
        "result": "fail"
      }
    },
    {
      "seq": 6,
      "t_offset_ms": 12069,
      "agent": "matching",
      "type": "check",
      "title": "Matched: Fresh Spring Rolls with Chicken",
      "detail": "All hard checks pass — sodium 420/500 mg ✓, carbs 41 g (target 40–70) ✓.",
      "data": {
        "meal_id": "M026",
        "result": "pass"
      }
    },
    {
      "seq": 7,
      "t_offset_ms": 14669,
      "agent": "matching",
      "type": "check",
      "title": "Matched: Steamed Rice Rolls with Mushrooms",
      "detail": "All hard checks pass — sodium 423/500 mg ✓, carbs 46 g (target 40–70) ✓.",
      "data": {
        "meal_id": "M030",
        "result": "pass"
      }
    },
    {
      "seq": 8,
      "t_offset_ms": 16620,
      "agent": "matching",
      "type": "check",
      "title": "Matched: Overnight Oats with Berries",
      "detail": "All hard checks pass — sodium 300/500 mg ✓, carbs 55 g (target 40–70) ✓.",
      "data": {
        "meal_id": "M050",
        "result": "pass"
      }
    },
    {
      "seq": 9,
      "t_offset_ms": 17592,
      "agent": "kitchen",
      "type": "output",
      "title": "Batch allocated: Chicken Congee with Scallions",
      "detail": "Serving drawn from scheduled batch B2 (100 servings, 7 labor hours on 2026-07-20).",
      "data": {
        "batch_id": "B2"
      }
    },
    {
      "seq": 10,
      "t_offset_ms": 19964,
      "agent": "donation",
      "type": "check",
      "title": "Donation D002 feeds batch B2",
      "detail": "Fresh Bok Choy (cases), Carrots (25 lb bags) from Bay Area Produce Exchange — triaged as kitchen ingredient.",
      "data": {
        "donation_id": "D002",
        "result": "kitchen_ingredient"
      }
    },
    {
      "seq": 11,
      "t_offset_ms": 21501,
      "agent": "delivery",
      "type": "output",
      "title": "Route assigned",
      "detail": "Client 1147 added to route R-SUNS-1 (Sunset), delivery 2026-07-21, window 10:00–12:00. Cold chain OK.",
      "data": {
        "route_id": "R-SUNS-1"
      }
    },
    {
      "seq": 12,
      "t_offset_ms": 24007,
      "agent": "orchestrator",
      "type": "output",
      "title": "Plan complete",
      "detail": "Client 1147: 7 compliant meal(s) at fallback level 1. 0 hard-constraint violations."
    }
  ]
}
