{
  "client_id": 1101,
  "scenario": "happy_path",
  "generator": "template",
  "events": [
    {
      "seq": 0,
      "t_offset_ms": 2522,
      "agent": "orchestrator",
      "type": "status",
      "title": "Referral received",
      "detail": "New referral from Zuckerberg San Francisco General for client 1101. Starting intake pipeline."
    },
    {
      "seq": 1,
      "t_offset_ms": 3531,
      "agent": "intake",
      "type": "output",
      "title": "Client profile structured",
      "detail": "Diet orders: cardiovascular. Allergies: egg, shellfish. Sodium ceiling 700 mg/meal, carbs 35–70 g/meal. Prefers Mexican; dislikes beef, cilantro. Cooking ability: stovetop. 7 meals/week, zone Bayview-Hunters Point."
    },
    {
      "seq": 2,
      "t_offset_ms": 5042,
      "agent": "orchestrator",
      "type": "status",
      "title": "Dispatching Clinical Matching Agent",
      "detail": "Hard constraint hierarchy locked: allergens → sodium → carbs → diet-order tags. Exclusion rules, never scoring penalties."
    },
    {
      "seq": 3,
      "t_offset_ms": 6857,
      "agent": "matching",
      "type": "thought",
      "title": "Scanning inventory",
      "detail": "Scoring all 80 meals against hard constraints, then ranking survivors by cuisine preference and dislike avoidance."
    },
    {
      "seq": 4,
      "t_offset_ms": 8246,
      "agent": "matching",
      "type": "check",
      "title": "Rejected: Veggie Enchiladas",
      "detail": "Excluded — diet order 'cardiovascular': meal lacks 'heart-healthy' tag.",
      "data": {
        "meal_id": "M033",
        "result": "fail"
      }
    },
    {
      "seq": 5,
      "t_offset_ms": 10438,
      "agent": "matching",
      "type": "check",
      "title": "Rejected: Chicken Pozole Verde",
      "detail": "Excluded — diet order 'cardiovascular': meal lacks 'heart-healthy' tag.",
      "data": {
        "meal_id": "M036",
        "result": "fail"
      }
    },
    {
      "seq": 6,
      "t_offset_ms": 11518,
      "agent": "matching",
      "type": "check",
      "title": "Matched: Calabacitas con Pollo",
      "detail": "All hard checks pass — sodium 374/700 mg ✓, carbs 43 g (target 35–70) ✓, no egg/shellfish ✓.",
      "data": {
        "meal_id": "M038",
        "result": "pass"
      }
    },
    {
      "seq": 7,
      "t_offset_ms": 13014,
      "agent": "matching",
      "type": "check",
      "title": "Matched: Turkey Picadillo with Rice",
      "detail": "All hard checks pass — sodium 440/700 mg ✓, carbs 48 g (target 35–70) ✓, no egg/shellfish ✓.",
      "data": {
        "meal_id": "M039",
        "result": "pass"
      }
    },
    {
      "seq": 8,
      "t_offset_ms": 15452,
      "agent": "matching",
      "type": "check",
      "title": "Matched: Chicken Fajita Bowl",
      "detail": "All hard checks pass — sodium 450/700 mg ✓, carbs 57 g (target 35–70) ✓, no egg/shellfish ✓.",
      "data": {
        "meal_id": "M031",
        "result": "pass"
      }
    },
    {
      "seq": 9,
      "t_offset_ms": 17255,
      "agent": "delivery",
      "type": "output",
      "title": "Route assigned",
      "detail": "Client 1101 added to route R-BAYV-1 (Bayview-Hunters Point), delivery 2026-07-21, window 12:00–14:00. Cold chain OK.",
      "data": {
        "route_id": "R-BAYV-1"
      }
    },
    {
      "seq": 10,
      "t_offset_ms": 18565,
      "agent": "orchestrator",
      "type": "output",
      "title": "Plan complete",
      "detail": "Client 1101: 7 compliant meal(s) at fallback level 0. 0 hard-constraint violations."
    }
  ]
}
