{
  "client_id": 1034,
  "scenario": "happy_path",
  "generator": "template",
  "events": [
    {
      "seq": 0,
      "t_offset_ms": 2263,
      "agent": "orchestrator",
      "type": "status",
      "title": "Referral received",
      "detail": "New referral from CPMC Van Ness for client 1034. Starting intake pipeline."
    },
    {
      "seq": 1,
      "t_offset_ms": 4235,
      "agent": "intake",
      "type": "output",
      "title": "Client profile structured",
      "detail": "Diet orders: diabetic, cardiovascular. Allergies: shellfish, fish. Sodium ceiling 600 mg/meal, carbs 45–65 g/meal. Prefers Mexican; dislikes nothing noted. Cooking ability: microwave. 7 meals/week, zone Tenderloin."
    },
    {
      "seq": 2,
      "t_offset_ms": 5760,
      "agent": "orchestrator",
      "type": "status",
      "title": "Dispatching Clinical Matching Agent",
      "detail": "Hard constraint hierarchy locked: allergens → sodium → carbs → diet-order tags. Exclusion rules, never scoring penalties."
    },
    {
      "seq": 3,
      "t_offset_ms": 8265,
      "agent": "matching",
      "type": "thought",
      "title": "Scanning inventory",
      "detail": "Scoring all 80 meals against hard constraints, then ranking survivors by cuisine preference and dislike avoidance."
    },
    {
      "seq": 4,
      "t_offset_ms": 9634,
      "agent": "matching",
      "type": "check",
      "title": "Rejected: Calabacitas con Pollo",
      "detail": "Excluded — carbs: 43 g outside 45–65 g range.",
      "data": {
        "meal_id": "M038",
        "result": "fail"
      }
    },
    {
      "seq": 5,
      "t_offset_ms": 11275,
      "agent": "matching",
      "type": "check",
      "title": "Rejected: Baja Fish Tacos",
      "detail": "Excluded — allergen: contains fish.",
      "data": {
        "meal_id": "M035",
        "result": "fail"
      }
    },
    {
      "seq": 6,
      "t_offset_ms": 12639,
      "agent": "matching",
      "type": "check",
      "title": "Matched: Turkey Picadillo with Rice",
      "detail": "All hard checks pass — sodium 440/600 mg ✓, carbs 48 g (target 45–65) ✓, no shellfish/fish ✓.",
      "data": {
        "meal_id": "M039",
        "result": "pass"
      }
    },
    {
      "seq": 7,
      "t_offset_ms": 14104,
      "agent": "matching",
      "type": "check",
      "title": "Matched: Chicken Fajita Bowl",
      "detail": "All hard checks pass — sodium 450/600 mg ✓, carbs 57 g (target 45–65) ✓, no shellfish/fish ✓.",
      "data": {
        "meal_id": "M031",
        "result": "pass"
      }
    },
    {
      "seq": 8,
      "t_offset_ms": 16038,
      "agent": "matching",
      "type": "check",
      "title": "Matched: Chicken Tinga with Rice",
      "detail": "All hard checks pass — sodium 454/600 mg ✓, carbs 48 g (target 45–65) ✓, no shellfish/fish ✓.",
      "data": {
        "meal_id": "M037",
        "result": "pass"
      }
    },
    {
      "seq": 9,
      "t_offset_ms": 17968,
      "agent": "delivery",
      "type": "output",
      "title": "Route assigned",
      "detail": "Client 1034 added to route R-TEND-1 (Tenderloin), delivery 2026-07-21, window 10:00–12:00. Cold chain OK.",
      "data": {
        "route_id": "R-TEND-1"
      }
    },
    {
      "seq": 10,
      "t_offset_ms": 20363,
      "agent": "orchestrator",
      "type": "output",
      "title": "Plan complete",
      "detail": "Client 1034: 7 compliant meal(s) at fallback level 0. 0 hard-constraint violations."
    }
  ]
}
