{
  "client_id": 1030,
  "scenario": "happy_path",
  "generator": "template",
  "events": [
    {
      "seq": 0,
      "t_offset_ms": 1183,
      "agent": "orchestrator",
      "type": "status",
      "title": "Referral received",
      "detail": "New referral from CPMC Van Ness for client 1030. Starting intake pipeline."
    },
    {
      "seq": 1,
      "t_offset_ms": 2782,
      "agent": "intake",
      "type": "output",
      "title": "Client profile structured",
      "detail": "Diet orders: cardiovascular. Allergies: fish, peanut. Sodium ceiling 600 mg/meal, carbs 35–70 g/meal. Prefers Vietnamese; dislikes beef. Cooking ability: microwave. 7 meals/week, zone Sunset."
    },
    {
      "seq": 2,
      "t_offset_ms": 4813,
      "agent": "orchestrator",
      "type": "status",
      "title": "Dispatching Clinical Matching Agent",
      "detail": "Hard constraint hierarchy locked: allergens → sodium → carbs → diet-order tags. Exclusion rules, never scoring penalties."
    },
    {
      "seq": 3,
      "t_offset_ms": 6618,
      "agent": "matching",
      "type": "thought",
      "title": "Scanning inventory",
      "detail": "Scoring all 80 meals against hard constraints, then ranking survivors by cuisine preference and dislike avoidance."
    },
    {
      "seq": 4,
      "t_offset_ms": 8997,
      "agent": "matching",
      "type": "check",
      "title": "Rejected: Fresh Spring Rolls with Chicken",
      "detail": "Excluded — allergen: contains peanut.",
      "data": {
        "meal_id": "M026",
        "result": "fail"
      }
    },
    {
      "seq": 5,
      "t_offset_ms": 11131,
      "agent": "matching",
      "type": "check",
      "title": "Rejected: Canh Chua (Sour Fish Soup) with Rice",
      "detail": "Excluded — allergen: contains fish.",
      "data": {
        "meal_id": "M025",
        "result": "fail"
      }
    },
    {
      "seq": 6,
      "t_offset_ms": 12487,
      "agent": "matching",
      "type": "check",
      "title": "Matched: Overnight Oats with Berries",
      "detail": "All hard checks pass — sodium 300/600 mg ✓, carbs 55 g (target 35–70) ✓, no fish/peanut ✓.",
      "data": {
        "meal_id": "M050",
        "result": "pass"
      }
    },
    {
      "seq": 7,
      "t_offset_ms": 14338,
      "agent": "matching",
      "type": "check",
      "title": "Matched: Winter Melon Soup with Chicken and Rice",
      "detail": "All hard checks pass — sodium 354/600 mg ✓, carbs 45 g (target 35–70) ✓, no fish/peanut ✓.",
      "data": {
        "meal_id": "M020",
        "result": "pass"
      }
    },
    {
      "seq": 8,
      "t_offset_ms": 16218,
      "agent": "matching",
      "type": "check",
      "title": "Matched: Ginataang Gulay with Rice",
      "detail": "All hard checks pass — sodium 401/600 mg ✓, carbs 51 g (target 35–70) ✓, no fish/peanut ✓.",
      "data": {
        "meal_id": "M006",
        "result": "pass"
      }
    },
    {
      "seq": 9,
      "t_offset_ms": 18712,
      "agent": "delivery",
      "type": "output",
      "title": "Route assigned",
      "detail": "Client 1030 added to route R-SUNS-1 (Sunset), delivery 2026-07-21, window 10:00–12:00. Cold chain OK.",
      "data": {
        "route_id": "R-SUNS-1"
      }
    },
    {
      "seq": 10,
      "t_offset_ms": 19645,
      "agent": "orchestrator",
      "type": "output",
      "title": "Plan complete",
      "detail": "Client 1030: 7 compliant meal(s) at fallback level 0. 0 hard-constraint violations."
    }
  ]
}
