{
  "client_id": 1045,
  "scenario": "happy_path",
  "generator": "template",
  "events": [
    {
      "seq": 0,
      "t_offset_ms": 1138,
      "agent": "orchestrator",
      "type": "status",
      "title": "Referral received",
      "detail": "New referral from Kaiser Permanente San Francisco for client 1045. Starting intake pipeline."
    },
    {
      "seq": 1,
      "t_offset_ms": 3413,
      "agent": "intake",
      "type": "output",
      "title": "Client profile structured",
      "detail": "Diet orders: renal. Allergies: tree_nut, egg. Sodium ceiling 550 mg/meal, carbs 45–75 g/meal. Prefers Indian; dislikes nothing noted. Cooking ability: microwave. 5 meals/week, zone Richmond."
    },
    {
      "seq": 2,
      "t_offset_ms": 4757,
      "agent": "orchestrator",
      "type": "status",
      "title": "Dispatching Clinical Matching Agent",
      "detail": "Hard constraint hierarchy locked: allergens → sodium → carbs → diet-order tags. Exclusion rules, never scoring penalties."
    },
    {
      "seq": 3,
      "t_offset_ms": 7057,
      "agent": "matching",
      "type": "thought",
      "title": "Scanning inventory",
      "detail": "Scoring all 80 meals against hard constraints, then ranking survivors by cuisine preference and dislike avoidance."
    },
    {
      "seq": 4,
      "t_offset_ms": 9157,
      "agent": "matching",
      "type": "check",
      "title": "Rejected: Rajma (Kidney Bean Curry) with Rice",
      "detail": "Excluded — diet order 'renal': meal lacks 'renal-friendly' tag.",
      "data": {
        "meal_id": "M068",
        "result": "fail"
      }
    },
    {
      "seq": 5,
      "t_offset_ms": 11382,
      "agent": "matching",
      "type": "check",
      "title": "Rejected: Chana Masala with Rice",
      "detail": "Excluded — diet order 'renal': meal lacks 'renal-friendly' tag.",
      "data": {
        "meal_id": "M063",
        "result": "fail"
      }
    },
    {
      "seq": 6,
      "t_offset_ms": 13804,
      "agent": "matching",
      "type": "check",
      "title": "Matched: Overnight Oats with Berries",
      "detail": "All hard checks pass — sodium 300/550 mg ✓, carbs 55 g (target 45–75) ✓, no tree_nut/egg ✓.",
      "data": {
        "meal_id": "M050",
        "result": "pass"
      }
    },
    {
      "seq": 7,
      "t_offset_ms": 15526,
      "agent": "matching",
      "type": "check",
      "title": "Matched: Winter Melon Soup with Chicken and Rice",
      "detail": "All hard checks pass — sodium 354/550 mg ✓, carbs 45 g (target 45–75) ✓, no tree_nut/egg ✓.",
      "data": {
        "meal_id": "M020",
        "result": "pass"
      }
    },
    {
      "seq": 8,
      "t_offset_ms": 16596,
      "agent": "matching",
      "type": "check",
      "title": "Matched: Ginataang Gulay with Rice",
      "detail": "All hard checks pass — sodium 401/550 mg ✓, carbs 51 g (target 45–75) ✓, no tree_nut/egg ✓.",
      "data": {
        "meal_id": "M006",
        "result": "pass"
      }
    },
    {
      "seq": 9,
      "t_offset_ms": 18486,
      "agent": "delivery",
      "type": "output",
      "title": "Route assigned",
      "detail": "Client 1045 added to route R-RICH-1 (Richmond), delivery 2026-07-21, window 12:00–14:00. Cold chain OK.",
      "data": {
        "route_id": "R-RICH-1"
      }
    },
    {
      "seq": 10,
      "t_offset_ms": 20854,
      "agent": "orchestrator",
      "type": "output",
      "title": "Plan complete",
      "detail": "Client 1045: 5 compliant meal(s) at fallback level 0. 0 hard-constraint violations."
    }
  ]
}
