{
  "client_id": 1077,
  "scenario": "happy_path",
  "generator": "template",
  "events": [
    {
      "seq": 0,
      "t_offset_ms": 954,
      "agent": "orchestrator",
      "type": "status",
      "title": "Referral received",
      "detail": "New referral from UCSF Medical Center for client 1077. Starting intake pipeline."
    },
    {
      "seq": 1,
      "t_offset_ms": 1984,
      "agent": "intake",
      "type": "output",
      "title": "Client profile structured",
      "detail": "Diet orders: cardiovascular. Allergies: none. Sodium ceiling 700 mg/meal, carbs 35–70 g/meal. Prefers Mediterranean; dislikes cilantro, beef. Cooking ability: microwave. 5 meals/week, zone Excelsior."
    },
    {
      "seq": 2,
      "t_offset_ms": 4299,
      "agent": "orchestrator",
      "type": "status",
      "title": "Dispatching Clinical Matching Agent",
      "detail": "Hard constraint hierarchy locked: allergens → sodium → carbs → diet-order tags. Exclusion rules, never scoring penalties."
    },
    {
      "seq": 3,
      "t_offset_ms": 6840,
      "agent": "matching",
      "type": "thought",
      "title": "Scanning inventory",
      "detail": "Scoring all 80 meals against hard constraints, then ranking survivors by cuisine preference and dislike avoidance."
    },
    {
      "seq": 4,
      "t_offset_ms": 8696,
      "agent": "matching",
      "type": "check",
      "title": "Rejected: Vegetable Moussaka",
      "detail": "Excluded — prep: requires oven, client is microwave-only.",
      "data": {
        "meal_id": "M056",
        "result": "fail"
      }
    },
    {
      "seq": 5,
      "t_offset_ms": 10202,
      "agent": "matching",
      "type": "check",
      "title": "Rejected: Veggie Enchiladas",
      "detail": "Excluded — diet order 'cardiovascular': meal lacks 'heart-healthy' tag.",
      "data": {
        "meal_id": "M033",
        "result": "fail"
      }
    },
    {
      "seq": 6,
      "t_offset_ms": 12582,
      "agent": "matching",
      "type": "check",
      "title": "Matched: Overnight Oats with Berries",
      "detail": "All hard checks pass — sodium 300/700 mg ✓, carbs 55 g (target 35–70) ✓.",
      "data": {
        "meal_id": "M050",
        "result": "pass"
      }
    },
    {
      "seq": 7,
      "t_offset_ms": 14209,
      "agent": "matching",
      "type": "check",
      "title": "Matched: Winter Melon Soup with Chicken and Rice",
      "detail": "All hard checks pass — sodium 354/700 mg ✓, carbs 45 g (target 35–70) ✓.",
      "data": {
        "meal_id": "M020",
        "result": "pass"
      }
    },
    {
      "seq": 8,
      "t_offset_ms": 16171,
      "agent": "matching",
      "type": "check",
      "title": "Matched: Hummus and Veggie Wrap",
      "detail": "All hard checks pass — sodium 451/700 mg ✓, carbs 52 g (target 35–70) ✓.",
      "data": {
        "meal_id": "M060",
        "result": "pass"
      }
    },
    {
      "seq": 9,
      "t_offset_ms": 17664,
      "agent": "kitchen",
      "type": "output",
      "title": "Batch allocated: Chicken Congee with Scallions",
      "detail": "Serving drawn from scheduled batch B2 (120 servings, 10 labor hours on 2026-07-20).",
      "data": {
        "batch_id": "B2"
      }
    },
    {
      "seq": 10,
      "t_offset_ms": 20176,
      "agent": "donation",
      "type": "check",
      "title": "Donation D002 feeds batch B2",
      "detail": "Fresh Bok Choy (cases), Carrots (25 lb bags) from Bay Area Produce Exchange — triaged as kitchen ingredient.",
      "data": {
        "donation_id": "D002",
        "result": "kitchen_ingredient"
      }
    },
    {
      "seq": 11,
      "t_offset_ms": 21388,
      "agent": "delivery",
      "type": "output",
      "title": "Pickup scheduled",
      "detail": "Meals for client 1077 ready for pickup 2026-07-21, window 10:00–12:00 (Excelsior group). Cold chain OK.",
      "data": {
        "route_id": "R-EXCE-2"
      }
    },
    {
      "seq": 12,
      "t_offset_ms": 22892,
      "agent": "orchestrator",
      "type": "output",
      "title": "Plan complete",
      "detail": "Client 1077: 5 compliant meal(s) at fallback level 1. 0 hard-constraint violations."
    }
  ]
}
