{
  "client_id": 1037,
  "scenario": "happy_path",
  "generator": "template",
  "events": [
    {
      "seq": 0,
      "t_offset_ms": 1792,
      "agent": "orchestrator",
      "type": "status",
      "title": "Referral received",
      "detail": "New referral from Zuckerberg San Francisco General for client 1037. Starting intake pipeline."
    },
    {
      "seq": 1,
      "t_offset_ms": 4364,
      "agent": "intake",
      "type": "output",
      "title": "Client profile structured",
      "detail": "Diet orders: renal. Allergies: none. Sodium ceiling 550 mg/meal, carbs 45–75 g/meal. Prefers American; dislikes kidney beans, pork. Cooking ability: microwave. 10 meals/week, zone Tenderloin."
    },
    {
      "seq": 2,
      "t_offset_ms": 5807,
      "agent": "orchestrator",
      "type": "status",
      "title": "Dispatching Clinical Matching Agent",
      "detail": "Hard constraint hierarchy locked: allergens → sodium → carbs → diet-order tags. Exclusion rules, never scoring penalties."
    },
    {
      "seq": 3,
      "t_offset_ms": 7954,
      "agent": "matching",
      "type": "thought",
      "title": "Scanning inventory",
      "detail": "Scoring all 80 meals against hard constraints, then ranking survivors by cuisine preference and dislike avoidance."
    },
    {
      "seq": 4,
      "t_offset_ms": 9361,
      "agent": "matching",
      "type": "check",
      "title": "Rejected: Grilled Chicken Garden Salad",
      "detail": "Excluded — carbs: 39 g outside 45–75 g range.",
      "data": {
        "meal_id": "M044",
        "result": "fail"
      }
    },
    {
      "seq": 5,
      "t_offset_ms": 11682,
      "agent": "matching",
      "type": "check",
      "title": "Rejected: Baked Salmon with Quinoa",
      "detail": "Excluded — carbs: 40 g outside 45–75 g range.",
      "data": {
        "meal_id": "M043",
        "result": "fail"
      }
    },
    {
      "seq": 6,
      "t_offset_ms": 12685,
      "agent": "matching",
      "type": "check",
      "title": "Matched: Overnight Oats with Berries",
      "detail": "All hard checks pass — sodium 300/550 mg ✓, carbs 55 g (target 45–75) ✓.",
      "data": {
        "meal_id": "M050",
        "result": "pass"
      }
    },
    {
      "seq": 7,
      "t_offset_ms": 14866,
      "agent": "matching",
      "type": "check",
      "title": "Matched: Winter Melon Soup with Chicken and Rice",
      "detail": "All hard checks pass — sodium 354/550 mg ✓, carbs 45 g (target 45–75) ✓.",
      "data": {
        "meal_id": "M020",
        "result": "pass"
      }
    },
    {
      "seq": 8,
      "t_offset_ms": 17085,
      "agent": "matching",
      "type": "check",
      "title": "Matched: Ginataang Gulay with Rice",
      "detail": "All hard checks pass — sodium 401/550 mg ✓, carbs 51 g (target 45–75) ✓.",
      "data": {
        "meal_id": "M006",
        "result": "pass"
      }
    },
    {
      "seq": 9,
      "t_offset_ms": 18397,
      "agent": "delivery",
      "type": "output",
      "title": "Pickup scheduled",
      "detail": "Meals for client 1037 ready for pickup 2026-07-21, window 10:00–12:00 (Tenderloin group). Cold chain OK.",
      "data": {
        "route_id": "R-TEND-1"
      }
    },
    {
      "seq": 10,
      "t_offset_ms": 19747,
      "agent": "orchestrator",
      "type": "output",
      "title": "Plan complete",
      "detail": "Client 1037: 7 compliant meal(s) at fallback level 0. 0 hard-constraint violations."
    }
  ]
}
