{
  "client_id": 1016,
  "scenario": "happy_path",
  "generator": "template",
  "events": [
    {
      "seq": 0,
      "t_offset_ms": 2193,
      "agent": "orchestrator",
      "type": "status",
      "title": "Referral received",
      "detail": "New referral from Zuckerberg San Francisco General for client 1016. Starting intake pipeline."
    },
    {
      "seq": 1,
      "t_offset_ms": 3210,
      "agent": "intake",
      "type": "output",
      "title": "Client profile structured",
      "detail": "Diet orders: renal. Allergies: fish, shellfish. Sodium ceiling 500 mg/meal, carbs 35–70 g/meal. Prefers Mexican; dislikes coconut milk, eggplant. Cooking ability: microwave. 7 meals/week, zone Western Addition."
    },
    {
      "seq": 2,
      "t_offset_ms": 4214,
      "agent": "orchestrator",
      "type": "status",
      "title": "Dispatching Clinical Matching Agent",
      "detail": "Hard constraint hierarchy locked: allergens → sodium → carbs → diet-order tags. Exclusion rules, never scoring penalties."
    },
    {
      "seq": 3,
      "t_offset_ms": 5802,
      "agent": "matching",
      "type": "thought",
      "title": "Scanning inventory",
      "detail": "Scoring all 80 meals against hard constraints, then ranking survivors by cuisine preference and dislike avoidance."
    },
    {
      "seq": 4,
      "t_offset_ms": 6727,
      "agent": "matching",
      "type": "check",
      "title": "Rejected: Turkey Picadillo with Rice",
      "detail": "Excluded — diet order 'renal': meal lacks 'renal-friendly' tag.",
      "data": {
        "meal_id": "M039",
        "result": "fail"
      }
    },
    {
      "seq": 5,
      "t_offset_ms": 8897,
      "agent": "matching",
      "type": "check",
      "title": "Rejected: Chicken Fajita Bowl",
      "detail": "Excluded — diet order 'renal': meal lacks 'renal-friendly' tag.",
      "data": {
        "meal_id": "M031",
        "result": "fail"
      }
    },
    {
      "seq": 6,
      "t_offset_ms": 10691,
      "agent": "matching",
      "type": "check",
      "title": "Matched: Overnight Oats with Berries",
      "detail": "All hard checks pass — sodium 300/500 mg ✓, carbs 55 g (target 35–70) ✓, no fish/shellfish ✓.",
      "data": {
        "meal_id": "M050",
        "result": "pass"
      }
    },
    {
      "seq": 7,
      "t_offset_ms": 12565,
      "agent": "matching",
      "type": "check",
      "title": "Matched: Winter Melon Soup with Chicken and Rice",
      "detail": "All hard checks pass — sodium 354/500 mg ✓, carbs 45 g (target 35–70) ✓, no fish/shellfish ✓.",
      "data": {
        "meal_id": "M020",
        "result": "pass"
      }
    },
    {
      "seq": 8,
      "t_offset_ms": 15122,
      "agent": "matching",
      "type": "check",
      "title": "Matched: Ginataang Gulay with Rice",
      "detail": "All hard checks pass — sodium 401/500 mg ✓, carbs 51 g (target 35–70) ✓, no fish/shellfish ✓.",
      "data": {
        "meal_id": "M006",
        "result": "pass"
      }
    },
    {
      "seq": 9,
      "t_offset_ms": 16241,
      "agent": "delivery",
      "type": "output",
      "title": "Pickup scheduled",
      "detail": "Meals for client 1016 ready for pickup 2026-07-21, window 14:00–16:00 (Western Addition group). Cold chain OK.",
      "data": {
        "route_id": "R-WEST-1"
      }
    },
    {
      "seq": 10,
      "t_offset_ms": 18660,
      "agent": "orchestrator",
      "type": "output",
      "title": "Plan complete",
      "detail": "Client 1016: 7 compliant meal(s) at fallback level 0. 0 hard-constraint violations."
    }
  ]
}
